{
  "id": "001",
  "subject": "KEIS",
  "source": "予備H18-21",
  "chapter": "第1編 序論",
  "section": "第3章 刑事訴訟法の構造",
  "page": 3,
  "crime": "刑事訴訟法の基本構造",
  "points": 2,
  "correct_rate": "88%",
  "instruction_type": "fillin8",
  "instruction": "次の【文章】は、刑事訴訟法の基本構造を審理・判決の対象との関係について述べた一つの見解である。①から⑧までの( )内に後記【語句群】から該当する語句を入れた場合、組合せとして正しいものを、後記1から5までのうちから一つ選びなさい。【文章】いわゆる旧刑事訴訟法（大正11年法律第75号、後述昭和23年法律第131号により全面改正、以下「旧法」という。）においても、公益の規範は検察官の職務であり、検察官は弾劾的訴訟構造を志向していた点では、現行法と類似している。旧法は、(①) を主義の基本構造を採用していた。旧法では、(②) に記載された犯罪事実に限られていた。これは(③) の同一性のある事実については、被告事件全体に対する裁判の対象として変容するとされていた。これに対し、現行刑事訴訟法（昭和23年法律第131号、以下「現行法」という。）は、(⑤) 主義の基本構造を採用し、(⑥) を訴訟の対象とした。職権変更命令は、立証の対象に関する職権行使の (⑦) を意味するものであり、職権変更命令は当事者主義の認定要件の基本構造に違反しないために、(⑧) を意味する役割しか期待していない。【語句群】a.弾劾主義 b.被疑事実 c.直接 d.当事者 e.公訴事実 f.糾問 g.口頭 h.義務 i.職権",
  "answer": 1,
  "answer_explanation": "解答および各肢の正誤判定",
  "override_pattern": "P1",
  "drill_blocks": [
    {"num": "01", "tag": "①職権主義 / 旧法の基本構造", "question": "Q. 旧刑事訴訟法は職権主義の基本構造を採用し、裁判所主導で事実認定を行う仕組みを持っていた。", "correct": "○", "explanation": "旧法は職権主義（糾問主義に近い構造）を採用し、裁判所が事件全体を職権で審理する仕組みであった。"},
    {"num": "02", "tag": "①糾問の誤り", "question": "Q. 旧刑事訴訟法は完全な糾問主義を採用していたとされる。", "correct": "×", "explanation": "旧法は職権主義であって完全な糾問主義ではない。検察官の弾劾的訴訟構造への志向も併存していた。"},
    {"num": "03", "tag": "④公訴事実 / 現行法の対象", "question": "Q. 現行刑事訴訟法では、審理・判決の対象は起訴状記載の公訴事実である。", "correct": "○", "explanation": "現行法は当事者主義を採用し、起訴状の公訴事実を審理対象として明示する。"},
    {"num": "04", "tag": "④被疑事実の誤り", "question": "Q. 現行法における審理対象は捜査段階の被疑事実であり、公訴事実ではない。", "correct": "×", "explanation": "被疑事実は捜査段階の概念で起訴後の審理対象ではない。審理対象は公訴事実。"},
    {"num": "05", "tag": "⑤当事者主義の採用", "question": "Q. 現行刑事訴訟法は当事者主義の基本構造を採用している。", "correct": "○", "explanation": "現行法は当事者主義を採用し、検察官と被告人を対等な当事者として位置づける。"},
    {"num": "06", "tag": "⑤職権主義の誤り", "question": "Q. 現行法は職権主義を採用していると説明される。", "correct": "×", "explanation": "現行法は当事者主義であり、職権主義は旧法の特徴。"},
    {"num": "07", "tag": "⑥当事者の対象", "question": "Q. 現行法は当事者の主張立証を訴訟の対象とする構造を採用する。", "correct": "○", "explanation": "当事者主義のもとで、検察官の起訴と被告人の弁護が訴訟構造の中心となる。"},
    {"num": "08", "tag": "⑦職権行使の意味", "question": "Q. 訴因変更命令は、裁判所による職権的訴訟指揮の一形態として位置づけられる。", "correct": "○", "explanation": "訴因変更命令は裁判所主導の訴訟指揮であり、当事者主義の枠内で職権行使の意義を持つ。"},
    {"num": "09", "tag": "⑧義務との対比", "question": "Q. 訴因変更命令の趣旨は、当事者主義の枠内で例外的に裁判所の関与を認めるものである。", "correct": "○", "explanation": "訴因変更命令は当事者主義原則を維持しつつ、必要な場合に裁判所が関与する例外的措置。"},
    {"num": "10", "tag": "肢1 / 正答", "question": "Q. 肢1（①職権、④当事者）が正解の組合せである。", "correct": "○", "explanation": "①には職権 (i)、④には当事者 (d) が入る組合せが現行刑事訴訟法の基本構造の解釈と整合する。"},
    {"num": "11", "tag": "肢2-5 / 誤りの組合せ", "question": "Q. 肢2-5のいずれも、①または④の組合せが現行刑事訴訟法の基本構造と整合しない誤った組合せである。", "correct": "○", "explanation": "肢2-5は①または④の組合せが現行法の論理と矛盾するため、いずれも誤り。正解は肢1のみ。"},
    {"num": "12", "tag": "横断 / 旧法と現行法", "question": "Q. 旧刑事訴訟法から現行刑事訴訟法への移行は、職権主義から当事者主義への基本構造の変革であった。", "correct": "○", "explanation": "刑事訴訟法の歴史的展開において、職権主義から当事者主義への移行は最も重要な制度変革。"}
  ],
  "choices": [
    {
      "label": "1",
      "stem": "①i・④d（①=職権、④=当事者）",
      "verdict": "1",
      "verdict_label": "正しい",
      "case_citations": [],
      "explanation": "①には旧刑事訴訟法（大正11年法律第75号）の基本構造を表す語句が入る。旧法は職権主義を採用しており、裁判所が事件全体を職権で審理する仕組みを持っていた。したがって①には i（職権）が入る。④には現行刑事訴訟法（昭和23年法律第131号）の審理対象を表す語句が入る。現行法は当事者主義を採用し、検察官と被告人を対等な当事者として位置づける構造であるから、④には d（当事者）が入る。よって、本肢1（①i・④d）は正しい組合せである。",
      "professor": {
        "summary": "①=職権（旧法の基本構造）、④=当事者（現行法の基本構造）の組合せが正しく、肢1が正解。",
        "note": "旧刑事訴訟法は職権主義（裁判所主導の訴訟構造）を採用し、現行法は当事者主義（検察官と被告人を対等な当事者とする構造）を採用した。①と④の組合せがこの制度史的展開と整合するのは肢1のみ。"
      }
    },
    {
      "label": "2",
      "stem": "②e・⑧h（②=公訴事実、⑧=義務）",
      "verdict": "2",
      "verdict_label": "誤っている",
      "case_citations": [],
      "explanation": "②には旧刑事訴訟法における犯罪事実の記載対象が入るが、これは公訴事実ではなく、旧法上の起訴状記載事項であるべきである。また、⑧は訴因変更命令の意義に関する語句であって、義務という単純な語ではなく、訴訟指揮上の権限的性格を表現する語が入る。したがって、本肢2は②と⑧の両方で意味的に整合しない組合せであり、誤っている。",
      "professor": {
        "summary": "②=公訴事実、⑧=義務の組合せは、旧法と現行法の構造的差異を正確に把握していない。",
        "note": "②に公訴事実を入れると現行法的記述になってしまい、旧法を述べる文脈と整合しない。⑧に義務を入れると訴因変更命令の本質（訴訟指揮上の措置）を表現しきれない。"
      }
    },
    {
      "label": "3",
      "stem": "③a・⑧e（③=弾劾主義、⑧=公訴事実）",
      "verdict": "2",
      "verdict_label": "誤っている",
      "case_citations": [],
      "explanation": "③には旧法における犯罪事実の同一性に関する概念が入るが、弾劾主義は訴訟構造を表す概念であって、ここに直接当てはまる語句ではない。また、⑧は訴因変更命令の意義に関する語であって、公訴事実という具体的概念ではなく、当事者主義との整合性を表現する語が入る。したがって、本肢3は誤った組合せである。",
      "professor": {
        "summary": "③=弾劾主義、⑧=公訴事実の組合せは、文脈的に整合しない。",
        "note": "弾劾主義は訴訟構造の総称であり③の具体的な意味位置に合わない。公訴事実は審理対象の概念で⑧の訴因変更命令の意義に合わない。"
      }
    },
    {
      "label": "4",
      "stem": "①e・⑧d（①=公訴事実、⑧=当事者）",
      "verdict": "2",
      "verdict_label": "誤っている",
      "case_citations": [],
      "explanation": "①には旧刑事訴訟法の基本構造を表す語句が入るが、これは公訴事実という審理対象の概念ではなく、訴訟構造の概念（職権主義）であるべきである。⑧には訴因変更命令の意義として当事者主義の維持を表す語句が入るが、当事者という名詞単独では訴訟指揮上の機能を表しきれない。したがって、本肢4は①の組合せが基本構造の概念整理として誤っている。",
      "professor": {
        "summary": "①=公訴事実の組合せは、旧法の基本構造（職権主義）を表すべき位置に審理対象の概念を当てはめており、構造的に誤り。",
        "note": "①は旧刑事訴訟法の構造を表す位置であり、公訴事実（審理対象の概念）ではなく職権主義（構造の概念）が入る。本肢は構造と対象の概念混同による誤り。"
      }
    },
    {
      "label": "5",
      "stem": "②b・⑥e（②=被疑事実、⑥=公訴事実）",
      "verdict": "2",
      "verdict_label": "誤っている",
      "case_citations": [],
      "explanation": "②には旧刑事訴訟法における犯罪事実の記載対象が入るが、被疑事実は捜査段階で用いられる概念であって、起訴後の審理対象とは異なる。また、⑥は現行法の訴訟対象を表す語句であって、当事者主義のもとで主張立証の対象となる概念（当事者の主張）が入るべきである。したがって、本肢5は②および⑥の両方で誤った組合せである。",
      "professor": {
        "summary": "②=被疑事実、⑥=公訴事実の組合せは、起訴前後の概念区別を誤っている。",
        "note": "被疑事実は捜査段階の概念で、起訴後の審理対象（公訴事実または当事者の主張）とは別概念。⑥に公訴事実を入れると現行法の当事者主義との整合が崩れる。"
      }
    }
  ]
}
