{
  "id": "001",
  "subject": "KEN",
  "source": "予備H19-1",
  "chapter": "第1編 総論",
  "section": "第1章 憲法と立憲主義",
  "page": 3,
  "crime": "法の支配",
  "points": 2,
  "correct_rate": "30%",
  "instruction_type": "fill-in",
  "instruction": "次の文章は、「法の支配」に関するものである。AからDまでの各空欄に、後記1から8の中から適切なものを補充して、文章を完成させなさい。文章本体は次のとおり: 「法の支配」の原理は、中世における「古き良き法」の擁護の思想から生まれ、英米法の根幹として発展してきた。古典的には、「法の支配」とは専制的な国家権力の支配、すなわち、「【A】支配」を排斥し、権力を法で拘束することによって、国民の権利・自由を擁護することを目的とする原理である。「法の支配」の原理にいう「法」の概念が問題となる。日本国憲法も、「法の支配」の原理に立脚しているといえる。それは、憲法の最高法規性の明確化、「【B】」の保障、適正手続の保障、【C】、「【D】」に見られるような司法権の拡大強化、そして裁判所の違憲審査権の確立などから明らかである。候補: 1.椿 / 2.憲法第76条第2項後段の行政機関による裁判の全面的禁止 / 3.憲法第11条及び第97条に規定されている、理念として「不可侵」である / 4.権力分立 / 5.人の / 6.憲法第76条第2項後段の特別裁判所の設置の禁止 / 7.基本的人権 / 8.憲法第12条に規定されているように「常に公共の福祉のためにこれを利用する責任を負い」",
  "answer": {"A": "5", "B": "7", "C": "3", "D": "6"},
  "answer_explanation": "解答および各空欄の正答対応",
  "override_pattern": "P3",
  "drill_blocks": [
    {"num": "01", "tag": "空欄A / 支配の対比", "question": "Q. 「法の支配」は、専制的な国家権力の支配、すなわち「人の支配」を排斥することを目的の一つとする。", "correct": "○", "explanation": "「法の支配」の古典的定式は「人の支配」との対比であり、権力を法で拘束することで国民の権利・自由を擁護する。"},
    {"num": "02", "tag": "空欄A / 候補の選別", "question": "Q. 空欄Aには「権力分立」が入る。", "correct": "×", "explanation": "「人の」が入る。「権力分立」は法の支配と関連はあるが、ここでの対比軸は人の支配 vs 法の支配。"},
    {"num": "03", "tag": "空欄B / 人権保障", "question": "Q. 日本国憲法における法の支配は、基本的人権の保障を内容の一つとして含む。", "correct": "○", "explanation": "憲法11条・97条等が基本的人権の不可侵性を規定しており、法の支配の中核的内容。"},
    {"num": "04", "tag": "空欄B / 候補の選別", "question": "Q. 空欄Bには「権力分立」が入る。", "correct": "×", "explanation": "「基本的人権」が入る。日本国憲法における法の支配の柱は人権保障であり、文脈にもっとも適合する。"},
    {"num": "05", "tag": "空欄C / 不可侵原理", "question": "Q. 憲法第11条及び第97条は、基本的人権を理念として「不可侵」と規定している。", "correct": "○", "explanation": "11条「侵すことのできない永久の権利」、97条「人類の多年にわたる自由獲得の努力の成果」として基本的人権の不可侵性を確認。"},
    {"num": "06", "tag": "空欄C / 候補の選別", "question": "Q. 空欄Cには「権力分立」が入る。", "correct": "×", "explanation": "憲法第11条及び第97条に基づく基本的人権の不可侵性についての記述が入る。権力分立は別の論点。"},
    {"num": "07", "tag": "空欄D / 司法権の拡大", "question": "Q. 憲法第76条第2項後段は、特別裁判所の設置を禁止し、司法権を通常裁判所に一元化する。", "correct": "○", "explanation": "76条2項後段は特別裁判所の設置を禁止し、通常裁判所による司法権の一元的行使を保障する。"},
    {"num": "08", "tag": "空欄D / 行政裁判の禁止との区別", "question": "Q. 76条2項後段は、行政機関による裁判の全面的禁止を定める規定である。", "correct": "×", "explanation": "76条2項後段は特別裁判所の設置禁止。「行政機関による裁判」とは別概念で、後段の射程ではない。"},
    {"num": "09", "tag": "横断 / 法の支配の核心", "question": "Q. 法の支配は、形式的合法性のみならず、実質的に「理にかなう」内容を法に求める考え方である。", "correct": "○", "explanation": "法の支配は形式的法治主義と区別され、法の内容自体の正当性 (実質的法治) を要求する。"},
    {"num": "10", "tag": "横断 / 民主主義との連関", "question": "Q. 法の支配は機械主義的な法概念ではなく、民主主義的な法概念と結びつく。", "correct": "○", "explanation": "法の支配における「法」は、国民の権利保障と民主主義に立脚した実質的内容を持つ概念。"},
    {"num": "11", "tag": "横断 / 司法の拡大強化", "question": "Q. 日本国憲法における法の支配の表れには、最高法規性の明確化、基本的人権の保障、適正手続の保障、特別裁判所の設置禁止、違憲審査制の確立がある。", "correct": "○", "explanation": "問題文の本論部分そのもの。法の支配の制度的表現として 5 つを列挙。"},
    {"num": "12", "tag": "横断 / 正解組合せ", "question": "Q. 空欄 A〜D の正解組合せは A=5、B=7、C=3、D=6 である。", "correct": "○", "explanation": "「人の」支配 (5) / 「基本的人権」 (7) / 11条・97条「不可侵」(3) / 特別裁判所設置禁止 (6) の組合せ。"}
  ],
  "choices": [
    {
      "label": "A",
      "stem": "「法の支配」とは専制的な国家権力の支配、すなわち、「【A】支配」を排斥し、権力を法で拘束することによって、国民の権利・自由を擁護することを目的とする原理である。",
      "verdict": "1",
      "verdict_label": "正しい",
      "case_citations": [],
      "explanation": "【A】には1若しくは5が入ることが考えられる。法の支配とは、専制的な国家権力の支配（人の支配）を排斥し、権力を法で拘束することによって、国民の権利・自由を擁護することを目的とする原理であって、【A】には、専制的な国家権力の象徴的存在である5が入る。",
      "professor": {
        "summary": "空欄Aには「人の」が入る。法の支配の古典的構造は「人の支配 vs 法の支配」の対比であり、これが原理の核心。",
        "note": "中世における「古き良き法」の擁護に発する法の支配は、王権 (人の支配) に対する制約として発展した。専制的国家権力の象徴である人の支配を排斥するという文脈で、空欄Aは「人の」となる。"
      }
    },
    {
      "label": "B",
      "stem": "日本国憲法も、「法の支配」の原理に立脚しているといえる。それは、憲法の最高法規性の明確化、「【B】」の保障、適正手続の保障、【C】、「【D】」に見られるような司法権の拡大強化、そして裁判所の違憲審査権の確立などから明らかである。",
      "verdict": "1",
      "verdict_label": "正しい",
      "case_citations": [],
      "explanation": "【B】には4若しくは7が入ることが考えられる。法の支配にいう「法」は、形式的法治主義の場合とは異なり、その内容の合理的でなければならないという実質的要件をも含む概念であり、ついては人権の概念とも強く結びつけられる。【B】には7（基本的人権）が入る。",
      "professor": {
        "summary": "空欄Bには「基本的人権」が入る。日本国憲法における法の支配の中核は人権保障であり、これが「法」の実質的内容を支える。",
        "note": "法の支配の「法」は単なる形式的ルールではなく、実質的に正当な内容を要求する。日本国憲法において、その実質的内容を支える柱が基本的人権 (11条・97条) であり、空欄Bには「基本的人権」が入る。"
      }
    },
    {
      "label": "C",
      "stem": "【C】、「【D】」に見られるような司法権の拡大強化、そして裁判所の違憲審査権の確立などから明らかである。",
      "verdict": "1",
      "verdict_label": "正しい",
      "case_citations": [],
      "explanation": "【C】には3若しくは8が入ることが考えられる。法の支配の内容としては、①憲法の最高法規性の観念、②個人の人権、③適正手続の保障、④司法権の独立、⑤違憲審査制が挙げられる。【C】には、憲法第11条及び第97条に規定されている基本的人権の不可侵性を端的に述べる3が入る。",
      "professor": {
        "summary": "空欄Cには「憲法第11条及び第97条に規定されている、理念として『不可侵』である」が入る。基本的人権の不可侵性を端的に表現する記述。",
        "note": "11条「侵すことのできない永久の権利」、97条「人類の多年にわたる自由獲得の努力の成果」として、基本的人権の不可侵性を明文で確認する条文を踏まえ、空欄Cは法の支配の内容として基本的人権の不可侵を述べる3が適合する。"
      }
    },
    {
      "label": "D",
      "stem": "「【D】」に見られるような司法権の拡大強化、そして裁判所の違憲審査権の確立などから明らかである。",
      "verdict": "1",
      "verdict_label": "正しい",
      "case_citations": [],
      "explanation": "【D】には4若しくは6が入ることが考えられる。法の支配の内容として、【D】は、裁判所の役割に対する尊重を意味する。憲法76条2項後段が特別裁判所の設置を禁止しており、司法権を通常裁判所に一元化することで、司法権の拡大強化に資する。【D】には、6（憲法第76条第2項後段の特別裁判所の設置の禁止）が入る。",
      "professor": {
        "summary": "空欄Dには「憲法第76条第2項後段の特別裁判所の設置の禁止」が入る。司法権の通常裁判所への一元化を担保する条文。",
        "note": "76条2項後段は特別裁判所の設置を禁じ、司法権を通常裁判所に一元化することで、法の支配の制度的基盤を整える。行政機関による裁判の禁止は別概念で、76条2項前段の射程。空欄Dには6が入る。"
      }
    }
  ]
}
